input,output
"I have been using it for a few days now. I love Windows 7 (coming from XP) and the laptop overall. It's very quick with Matlab, Word, and whatnot. I will try to keep it free of crappy software and I hope it lasts a long time.

Construction is plastic, but is solid. There is some keyboard flex in the S,D,E key neighborhood. The arrow keys are a bit small and weirdly positioned, the right shift is smaller than the left shift. There is a number keypad, which is nice, but I don't use it. The screen is pretty and glossy (could be good or bad thing, depending on what you do). The webcam works well, but it's only VGA. Speakers are decent, given that it's a laptop, but my definition of decent may differ from yours.

One of the cheapest laptops out there with Core i5 and 1Gb of dedicated video memory + 4Gb RAM + 500Gb drive. It's not compact, but it's not bulky either. Beats the hell out of my old Toshiba Satellite A15 that I had in college. Laptops have come a long way in the past few years.

I hope this helps.","['xp laptop overall', 'quick matlab word whatnot', 'free crappy software hope', 'long time construction plastic', 'solid keyboard', 'key neighborhood arrow key bit', 'number keypad', 'nice use screen', 'pretty glossy good', 'bad thing', 'webcam work vga speaker', 'laptop definition', 'decent differ', 'cheap laptop core gb', 'video memory gb ram gb drive', 'old toshiba satellite college laptop', 'way past year hope']"
"I bought this laptop a week ago and it has given me nothing but problems.  It keeps shutting it self off and when I rebut, it has a black screen telling me it was closed down incorrectly.  I called an Asus tech. and they had me put in the rescue disk to reload the OS.  I did.  Well it kept doing the same thing and then it just would not rebut.  Just a solid gray screen it was fried.  I called the tech. who, once again had me reinstall the OS which took over an hour this time.  And, of course, I had to reload my printer etc.  Well, it went black again, shut itself off.  I called Asus and said I want to replace it with another.  They said they don't do that.  Now, mind you, it shut itself down everyday I used the thing.  So I called Amazon and they had UPS pick it up today and I am getting another laptop which won't be an Asus.  Now maybe it was just a lemon, who knows, but Asus should have made it good plus given me a tech I could understand.","['laptop week', 'shut self rebut', 'black screen', 'asus tech rescue disk reload os', 'thing rebut', 'solid gray screen fry', 'tech reinstall os', 'hour time course reload printer etc', 'black shut', 'mind shut', 'everyday thing', 'amazon ups']"
"15.6 inch screen, and the size/weight of the laptop is perfect for me - not too large.
Screen is sharp, details, color, and contrast are excellent - even if using outdoors.
The I5 is really fast - cranks up and down depending on the workload.
The laptop is really very quiet, which surprised me.  Some heat produced, but I can work comfortably with it sitting on my lap.
The case, including the navigation pad is slightly patterned - looks nice, has a good solid feel, minimal fingerprints.
The keyboard has a lot of flex, which bothered meet initially.  But I've looked at some other ASUS laptops in the store, they all seem to have a fair amount of flex - maybe it's made that way in case you're banging hard on the keys.  The chiclet keys themselves have a good feel and are well spaced - full numeric keyboard on the side is a plus.
Battery usage can be adjusted - I would say 2 1/2 hours battery time in the performance mode.
Included utilities may or may not be useful, not too much other included software - get rid of the Trend AV package, Norton 360 works well.
Overall - very happy with the purchase.","['inch screen size weight laptop', 'perfect large screen', 'sharp detail color contrast', 'excellent outdoors', 'fast crank', 'workload laptop', 'quiet surprise heat', 'lap case', 'pattern look', 'minimal fingerprint keyboard lot', 'bother meet', 'asus laptop store fair', 'way case', 'hard key chiclet key good', 'space numeric keyboard', 'battery usage', 'hour battery time performance mode', 'rid trend av package norton work overall', 'happy purchase']"
"This netbook has a great feature set and works well, despite a few niggling flaws.

PROS: Bright, full resolution screen, great battery life, HD accelerator, bluetooth, smudge-free case, kinda decent speakers, nice touchpad, very light.

CONS: Noisy keyboard, keyboard flex, takes some tweaking to get the Broadcom card to work well, bad speaker placement (under the front), stiff trackpad button.

FINAL THOUGHTS
Other users complain about bloatware and there really isn't all that much.  And like any new computer, it takes awhile to configure it.  I also added an SD card for a little ReadyBoost speed bump and will add another gig of RAM, but when it's in Super Performance mode, it does everything with minimal, if any, hesitation.  I'm hoping the extra RAM will speed things up.

I bought this mostly as a media player and it does that well.  480 Hulu can be twitchy at times but Netflix and Youtube play very well.  It's my first time using Windows 7 Starter and so far I haven't found a real need to upgrade.

The battery lasts for well over 8 hours, which is fantastic.  They keyboard is noisy and flimsy but I can type fairly quickly with it.  Frankly, with the video accelerator and the full screen resolution, it's the netbook I wanted at a very reasonable price.  I can live with its few shortcomings.","['niggle flaw pros', 'bright resolution screen', 'great battery life hd accelerator bluetooth smudge', 'free case', 'decent speaker', 'nice touchpad', 'light cons noisy keyboard keyboard', 'tweak broadcom card work', 'bad speaker placement', 'stiff trackpad button', 'final thoughts user complain bloatware', 'new computer', 'awhile configure', 'sd card', 'readyboost speed bump', 'gig ram', 'super performance mode minimal hesitation hope', 'extra ram speed thing', 'medium player hulu twitchy time netflix youtube play time windows starter', 'real need upgrade battery', 'fantastic keyboard noisy flimsy type', 'video accelerator screen resolution netbook', 'reasonable price']"
"After reading the reviews from other buyers on this site, I wanted to buy one at a store to make sure everything's working before bringing one home.

I'm glad I was prepared by others re: the type of product I was getting.

The playback of youtube files at 720p and 1080p produced crisp, sharp slideshow quality. So the processor cannot handle smooth playback. The cpu usage was at a whopping 100% when trying to play the 1080p vid.

Then again, the screen is so small that 480p is amazing already.

Like some others, I don't like the highly reflective screen, but I understand why a matte screen like the 1005PE wasn't used. The pixels are so small that a matte finish would actually distort the light from the tiny pixels.

On the advice of others I immediately upgraded to a 2gb RAM, so I can't say if it's made a difference or not.

Overall, this lil' guy fits the bill for me for internet browsing, skype, and writing papers.","['review buyer site', 'sure work', 'type product', 'playback youtube file', 'sharp slideshow quality processor', 'smooth playback cpu usage', 'vid screen', 'reflective screen', 'matte screen', 'pe pixel', 'small matte finish', 'light tiny pixel advice', 'upgrade gb ram difference overall lil guy', 'fit bill internet']"
"My first attempt ended with me having to ship the unit back to Amazon because the unit did not have the Broadcom Crystal HD Accelerator.  I too called ASUS to see if they could help but they were of no help what-so-ever.  Bravo, Amazon for excellent customer service!!  Unfortunately, I had to wait almost a month before Amazon had the unit back in stock and I just received my new unit a few days ago.  I must say, I LOVE IT!  I did uninstall some of the bloatware (anything that said Microsoft Office), enabled ReadyBoost with a 4G SD card, updated the Adobe Flash to 10.1 and replaced IE with Firefox (much faster than IE!). I am happy to report that so far I can watch videos and TV episodes without any stuttering. Haven't tried movies yet.  I did purchase the Kingston 2Gb 800Mhz DDR2 CL5 Memory and it should be here next week.  But even w/out it, my little netbook is pretty fast so hopefully when I upgrade the memory, this little baby will fly!!","['attempt end', 'ship unit amazon unit broadcom crystal hd accelerator', 'bravo amazon', 'excellent customer service', 'month amazon unit stock', 'new unit day', 'uninstall bloatware', 'microsoft office', 'enable readyboost sd card update adobe flash', 'ie firefox', 'fast ie', 'happy report', 'video tv episode', 'movie purchase kingston gb mhz ddr cl memory week', 'upgrade memory', 'baby fly']"
"I live in Japan and wanted a netbook for my regular flights to and from the U.S. The 1005PR seemed ideal, so I purchased one and had it sent to a relative in the U.S. (Most electronic goods can't be shipped out of the U.S.) Naturally, Murphy's Law kicked in and I received one that did not have the Broadcom chipset. The ensuing struggle with ASUS's phone support to get an RMA was so monumentally horrible that it poisoned me against the ASUS brand permanently. (I had to postpone a trip to the States, so, sadly, I fell out of Amazon's 30-day warranty window.) Here's the message I left ASUS on my customer satisfaction survey:

Dealing with ASUS phone support was so unpleasant that, while I think ASUS products are generally of very high quality and have built two pcs with ASUS motherboards and other components, I will never purchase another ASUS product. I bought an ASUS Eee PC 1005PR-PU17-BK that did not have a functioning Broadcom HD chipset. This problem was widespread and well documented by other purchasers on the Amazon and Newegg websites. Amazon even pulled the netbook off its site for a time because of the problem. Regardless, ASUS's phone support reps seemed to have zero knowledge of this, and they did everything they could, including twisting truth into a pretzel, to avoid giving me an RMA. Good going, ASUS. Your phone support is cutting off your customer loyalty at the knees.","['regular flight pr', 'ideal purchase', 'relative electronic good ship', 'murphy law', 'broadcom chipset ensue struggle asus phone support rma', 'horrible poison asus brand', 'postpone trip states', 'fall amazon day warranty window message', 'asus customer satisfaction survey', 'asus phone support', 'asus product', 'high quality', 'pc asus motherboard component purchase asus product', 'asus eee pc pr pu bk function broadcom hd chipset problem', 'widespread document purchaser amazon newegg website amazon pull netbook site time problem regardless asus phone support rep zero knowledge', 'twist truth pretzel', 'rma good', 'asus phone support', 'customer loyalty knee']"
"With the latest broadcom drivers (3.3.0) and flash software:

pros:

- sleek and well built. Not the thinnest around but the battery is almost flush with the body (not promiscuously hanging in the back as most).
- bright HD screen. You can work as you are used to on a bigger laptop, plenty of room. The fonts are not too small (also can be increased).
- perfect decoding (silky smooth) of 1080p 720p 480p h264 videos files with included  total media theater 3 player and MPC-HC, etc.
- Youtube (windowed) 1080p = ~22 fps, 720p=~22fps
- Youtube (fullscreen) 1080p = ~8 fps, 720p=~12fps. Amazingly, it is still watchable
- youtube (fullscreen with total media theater 3)  1080p, 720p ... silky smooth!. Works from clicking a play icon on the youtube video thumbnails in internet explorer only. 35-60% cpu max in power saving mode for 1080p
- long battery life
- noise cancelling microphones tech (with two microphones)
- great keyboard
- sdcard slot allows the card to be flush with the case

cons:

- webcam could be better in low light but ok in most conditions
- no desktop vsync due to lack of aero in win7 starter => some tearing occur on the desktop. it does not affect playing videos with total media theater 3.
-  touchpad has to be tuned (disable zooming gesture)
- lack of aero on windows 7 starter makes the desktop look laggy so better optimize for performance (remove windows decorations). Tried linux 3d desktop and it is silky smooth so it is a software issue with starter.

Very happy with my purchase overall.","['late broadcom driver flash software', 'pro sleek', 'thin battery flush body', 'bright hd screen work', 'big laptop plenty room font', 'small increase', 'perfect decode silky', 'smooth video file', 'total media theater player mpc hc etc youtube windowe fps fps youtube fullscreen fps fps', 'watchable youtube fullscreen total medium theater silky', 'smooth work click play icon youtube video thumbnail internet explorer cpu max power', 'long battery life noise', 'microphone tech microphone', 'great keyboard sdcard slot', 'card flush case', 'con webcam', 'low light ok condition desktop vsync lack aero', 'video total media theater touchpad tune', 'gesture lack aero window starter', 'desktop look laggy', 'optimize performance', 'window decoration', 'linux desktop silky', 'smooth software issue starter', 'happy purchase overall']"
"I agree that you should consider waiting before buying the 1005PR. Several people, myself included, are having problems with the Broadcom Crystal HD either not being present or not working.  If you just got yours, check in Device Manager, under Video, Sound, Game Controllers and see if Broadcom Crystal HD is there.  Even if it is, try to play an HD (720P) video from YouTube and see if it stutters or plays smoothly.  I just talked to ASUS and they claim they are unaware of the problem and after I do a complete reinstall, they will send me a RMA to return it, if it still doesn't work.  The 1005PR without the HD is kind of pointless. Oh, and for what it's worth, I don't like the flush mounted track pad, since my finger keeps going off the edge. But I knew that before I bought it and wanted the ability to play HD video. If this problem is fixed, this may turn out to be an excellent netbook.  We shall see.

UPDATE: Now that most things are working, I've rerated the 1005PR.","['pr people', 'problem broadcom crystal hd', 'present work', 'check device manager video', 'sound game controllers broadcom crystal hd', 'hd video youtube stutter play', 'unaware problem', 'complete reinstall', 'rma return work pr hd kind pointless oh', 'flush mount track', 'ability play hd video problem fix', 'excellent netbook', 'update thing work rerate pr']"
"I had a Dell 1011 and a Dell Latitude 2100 before, and I really loved the portability factor of the netbook concept. The thing that bugged me the most is the small screen resolution. And FINALLY Asus comes out with a netbook with a HD screen! I considered this netbook along with Sony's and HP's offers that all came with a 1366x768 screen, and finally settled on the Asus because: Sony's is wayyyyy overpriced, HP has a standard 3 cell battery, the 6 cell sticks out, and Asus' reputation and quality.

Pro:
GREAT textured lid. Its very high end feeling, not glossy.
HD screen. now I can finally do some work without having to scroll every 2 seconds.
Long battery life. I never got 11 hours, but I get 6-7 hours on good brightness and everything enabled. And thats more than enough for me.

Con:
Chicklet keyboard. It has too much flex for me. I prefer their non-chicklet style keyboard better. Much more solid.
Trackpad: I hate trackpads that are ""built in"""" with the palm rest. And there is no textual differnces","['dell dell latitude', 'portability factor netbook concept thing bug', 'small screen resolution', 'netbook hd screen', 'netbook sony hp', 'asus sony wayyyyy overprice hp', 'standard cell battery cell', 'asus reputation quality', 'pro great texture lid high end', 'glossy hd screen', 'long battery life', 'hour hour good brightness', 'enable con chicklet keyboard', 'non chicklet style keyboard', 'solid trackpad', 'palm rest textual differnce']"
"MY ASUS 1005PR IS BEING RETURNED! AMAZON SHOULD NOT PARTICIPATE IN THIS DECEPTION!!!
I too found out that it is impossible to play Dolby Digital 5.1 AC3 on some H264 Blueray files. I could not believe that when you went to open file and pointed TMT3 to a BD folder it didn't open it. I was very disappointed because if you have to play just the .m2ts you lose the chapters and more importantly any of the forced subs. I all ready own the TMT Extreme and thought I would install it. It plays the movie from the BD folder and also has sound BUT the video playback is not fluid at all, It jerks and studders all over the place. I finally had to do a full F9 reinstall to get the old version TMT3 back to working. What a rip off if they try to sell us an upgrade for 99 bucks. I think that the ASUS 1005PR is a great idea but I am already out 425 dollars for it, plus 80 dollars for 2Gigs of ram (what a rip off cause they should have put it in or at least offered it as upgrade since it is painfully slow with out it and after upgrade you are left with a useless 1Gig stick.), so for 500 dollars I might as well wait till some one else offers a comparable net book that will play real HD content. Arcsoft did this same old crap with the Hauppauge HD PVR 1212. It came with TMT but was crippled with no way to edit the files untill you paid more. I've had it and have bought 2 Asus monitors Asus PG-221 and the way too expensive VK-266H plus lots of motherboards but this is the last time I trust them to play square. I am sending back my Asus 1005PR and hope everyone else does the same.  Seeya ASUS and Arcsoft, wouldn't wanna buy ya, you're a bunch of CROOKS. Have fun screwing over all your customers untill they get smart","['asus pr', 'impossible play dolby digital ac blueray file', 'open file point tmt bd folder', 'force sub', 'ready tmt extreme', 'install play movie bd folder', 'sound video playback fluid jerk studder place', 'old version tmt work rip', 'upgrade buck', 'asus pr', 'great idea dollar', 'dollar gig ram rip', 'slow upgrade', 'useless gig', 'comparable net book play', 'real hd content arcsoft', 'old crap hauppauge hd pvr', 'way edit file untill pay', 'asus monitor asus pg way', 'expensive vk', 'lot motherboard time trust play square', 'asus pr hope seeya asus arcsoft wan na', 'ya bunch crooks fun screw customer untill smart']"
"I grew up on PCs, converted via a Macbook Pro to Mac in 2005, and am now converting back to PCs because of this little netbook. Upgraded to 2GB RAM, de-bloated, and stripped down to the basics this computer runs like a dream and can handle a pretty demanding load. Like other reviewers have said, when you get this clean all the bloat off the system, install an extra GB of RAM, and upgrade to Home Premium. I do anthropological fieldwork and this is great for working on Office, uploading raw audio files, storing audio and video for entertainment, and uploading pictures and viewing them. I even uploaded HD video from my camcorder and edited it while in Africa. The last time I did fieldwork with my Mac it overheated and the battery broke. It also slugged through 50 minutes of battery life. This computer, however, charges very fast and stays charged for 10-12 hours. Even after 9 months, I'm still getting 8-9 hours out of this. It runs cool, runs long, and never crashes.

My only complaint is in the actual structure of the computer. Why can't ASUS sell a ""premier"""" line of netbooks made from aluminum that don't feel so cheap? Seriously","['pro mac', 'netbook upgrade gb ram', 'basic computer run', 'clean bloat system install', 'extra gb ram upgrade home premium anthropological fieldwork', 'great work office upload', 'raw audio file store audio video entertainment upload picture view upload hd video camcorder edit africa time fieldwork mac overheat battery', 'slug minute battery life computer charge', 'charge hour month', 'hour run', 'cool run', 'long crash complaint', 'actual structure computer asus', 'premier line netbook aluminum']"
"First let me say that the netbook looks great and is really light. Even with a padded sleeve, this takes up much less room in my bag and is really light.

I read other reviews where fingerprint smudges were mentioned. This definitely happens, and because it's so shiny the smudges are obvious, but they easily wipe off.

Beyond the appearance, the keyboard is nice - actual raised keys that are satisfying to touch. Unfortunately, on a couple of occasions, the keys did not seem to catch up with me as I typed (I type quite quickly) and that meant that I had to go back and revise many words that were misspelled. I like the mouse touchpad and buttons (actually one button with two sides - nice), but it takes a little getting used to.
The screen is bright and crisp and I was pleasantly surprised at the resolution quality.

The netbook comes with 1GB of RAM and I upgraded almost immediately as this was simply not enough and I was not happy with how slow programs and websites loaded. For $60 I bought a 2GB memory card and found it pretty easy to swap in. Note: There is only one card slot, so to upgrade, you will need to get a 2GB card and not an additional 1GB card.
I bought an external ASUS DVD read/write drive for $72 which works well but ends up being a little bulky to carry around once it is in it's case. This is the opposite of what I was trying to do by adding a netbook to my laptop collection.
I have not upgraded to full windows 7 yet but am likely to do that as the starter version of the operating system is very basic and limiting.

By the time you buy the memory card, CD/DVD drive and upgrade to windows you could easily have a richer function laptop (or an ipad and a couple of hundred dollars to spend on content) so I'm not sure I would recommend this to everyone.

The one significant problem that I have encountered is with the headset output. I was trying to use the netbookch a movie on a plane and could not hear anything. Even though I was using noise isolating headphones, the output from the netbook was really low and made it basically useless for media viewing in public (i.e. with a headset).

Overallthis is not a bad netbook and is reasonable value for money but beware of the sound limitations and the extra costs for upgrades.","['netbook look', 'great light', 'room bag', 'review fingerprint smudge', 'shiny smudge', 'wipe appearance keyboard', 'nice actual raise key', 'couple occasion key catch type type', 'revise word misspell', 'mouse touchpad button', 'button side', 'bright crisp', 'resolution quality netbook', 'gb ram upgrade', 'happy slow program website load', 'gb memory card', 'note card slot upgrade need gb card', 'additional gb card', 'external asus dvd', 'drive work end', 'netbook laptop collection upgrade window', 'likely starter version', 'basic limit time', 'memory card cd dvd drive upgrade window', 'rich function laptop ipad couple dollar', 'significant problem encounter headset output', 'netbookch movie plane', 'noise isolate headphone output netbook', 'useless medium view', 'public headset overallthis', 'bad netbook', 'reasonable value money beware', 'sound limitation', 'extra cost upgrade']"
