input,output
"Bought this laptop for my son, who is a college student and was interested in a touchscreen laptop. After 3 weeks, the touchscreen stopped working along with the touchpad, gyroscopic driver, and keyboard. After countless hours of talking to customer service from HP and even letting them have remote-access, they simply do not want to help. In addition, they kept telling me about the raving reviews they had for the laptop. Well, looks like I'm writing the first review. After this debacle, I wouldn't recommend this product or company to any of my fellow Amazon customers. Please consider purchasing a different laptop from a different company who will actually provide decent service.

PS: HP will refuse to help you unless you've purchased the laptop from HP, so this is in no means Amazon's fault. Amazon's hands are tied in this situation and HP simply sold me a faulty product and will not admit it or replace it in a timely manner.",
"I love this laptop, but I've had a couple problems. There is only windows modern standby (S3) available for sleep modes  while plugged in and this thing is constantly turning on my display and fans at night. If it's not in your bedroom - probably not a problem. But it's bad enough for me to knock a star off.

Second - a few times for a few months after it arrived, it would hard lockup while sleeping. No input would wake it and I would have to shut it down with the power button. Don't know if it was some kind of bios or driver issue, but it seems to have gone away and haven't had to do that for quite some time now.

As for the pros - It's a beast of a machine with an RTX3070 and a ryzen processor which are kind of hard to find together. The screen is beautiful. The keyboard is functional but not particularly good or bad. Wifi and Bluetooth are similarly passable. RAM is kind of low on this model and you'll want to upgrade. Note that it contains two 8GB sticks, not a single 16GB so if you want 32GB you need two 16's. M2 socket to add a harddrive is easy to use, but the case is a little challenging to open. Make sure to watch an instruction video.",
"This is a great laptop.

Had another bombastic review written but some Karen seller probably negged it so here we go again.

Last computer was a dual xeon workstation. 64 cores and cpumark was only a few k higher but power consumption at idle was what this thing uses at max.

Equivalent performance. Serious energy savings.

Mines the coin with the right drivers and has almost paid for itself in idle production.

Wait for a fifteen hundo price point (this is prolly where Karen negged me cause sellers be tripping like pronoun peoples when you point out their mental illness). I Digress. This is a fantastic laptop for any sex, male or female will enjoy it immensely.

Whether it's my little pony or cyberpunk it'll run it maxed out 2k with full eye candy.

Make sure you check msrp and hold the line at fourteen ninety nine. Karen will love you.

I own both the 17"" and the 15"" models so I have options when I travel. Both are great. The big difference is an additional full size Sata in the 17"". Cheaper storage upgrades.

I upgraded to 64gb Sammy rammy. Runs it all. Werd.",
"I am a creative professional, who needed a laptop to edit, pictures, videos, make some motion design stuff and experiment with 3D stuff. Now I was coming from an all in one desktop set up called Lenovo 520, which limited me from trying many things, such as 3d but it was good enough for 1080p video editing.

However since I was always on the move with clients, I needed something portable, reliable and strong enough to handle almost everything I throw at it, I was looking at zephyrus g14,g15, legion 5 pro and many laptops in the same class but this one stuck out to me cuz it was giving the best processor available at the time, 5900HX, and the graphic card I wanted, RTX 3070.

Now even though I bought this laptop for professional creative work, this laptop is a gaming BEAST, it handles everything with so much ease, and does it really well. Almost all games are able to achieve higher than 100fps, which is insane, especially for someone like me who has played on consoles all his life, 30fps was usually the limit but theres so many possibilities with a gaming computer.

As for my creative work, it handles everything like a champ! even on battery and igpu turned on it performs extremely well and I see almost no issues, when working on photoshop, or editing my videos.

However not everything is perfect, while this laptop is great in almost all regards, I am often really worried about its longevity. I expect to use this machine for at least 5 years, my issue comes down to how the heat is handled or how toasty it actually gets. I don't mind too much fan noise cuz I have my headphones plugged in and its non existent to me, but while I game on performance mode, which is the default profile setting for cpu,gpu and the fans, I see temperatures around 80 or sometimes even 85 while playing Witcher 3, on high settings, I bring it down to medium settings and it almost makes no big difference, and sometimes even in my creator tasks which aren't very demanding, it again reaches around 70 degrees celcius. I have however found a solution to this, and use manual profile, which does get a bit loud but the temps are great. however I do worry about the fans and their lifespan cuz of it. you can always get a cooling pad and help yourself as well. i heard people get great results from that as well.

in conclusion, the best laptop I have tried, amazing performance, amazing size and fun to play on. worth it in my use case, only downside being the temperatures but you can work around the problem in various ways!",
"This computer is a beast. What I was really impressed with is how long you can use it on battery if you arent doing heavy gaming. You can set it to igpu mode which will let it last 8-9 hours on battery as long as you put it on silent mode. For streaming, browsing and doing documents it should last at least 6 hours.

I really wanted a 1440p screen but with this screen at 300hz its beautiful! Im not a big fan of LCD but its a very high quality screen. Pictures dont do it justice. If I want 4K Ill just hook it up to a TV.

I like that its a very small 15 laptop. Its not chunky at all and its not over designed. I thought I would have heat issues with a 3070 but the laptop handles the heat very well. Its not burning my legs when gaming.

Ive had no problem playing all my games maxed out. A lot of the benchmarks I see for this use poorly optimized games so its not fair to this laptop.

The keyboard is nice. I didnt want a mechanical keyboard because they get noisy. With LEDs off on everything it looks low profile. Its really easy to turn the LEDs and to customize.

I really havent seen any bottlenecks for what I use it for. This laptop is the sweet spot. In my opinion this is better designed than the Zephyrus because the rear heat exhaust isnt hitting the screen.

Only thing I would have liked to see is a numpad with the keyboard and an aluminum frame.",
"Being my first Mini Computer I was impressed with the size vs advertised specs.  To my surprise after hooking the machine up everything seemed to be in order and functioning.  UNTIL!!!

Literally days before the unit's 90days with me arrived, disaster.  Unit boots, black screen, BOIS.  Anytime and Every time.  Tried all the troubleshooting I could come across.  So as i gave up hope and contacted Amazon (still 2 days it it's 90th with me), who informed me they would not issue a replacement nor would they accept the unit as a return.  They instructed me to research the manufacture myself for contact info.  Way you go Amazon CS you really followed through here (Amazon CS did stay true to themselves - BECAUSE THEY TREAT ALL MY RECENT ISSUE LIKE THIS).  Long story make slightly shorter, after finally finding some link/email for manufacture but received no response  from them (1month to date).  The seller was very reluctant to offer their help it seems.  Partly due to there being no data recovery policy in place for this unit and or situations similar to mine. So far best offer to fix this is 1.)I pay for shipping to manufacture, and SUBMIT the bill to seller for reimbursement 2.)Some time after shipping unit to manufacture and submitting proof to seller, SELLER will send me a similar replacement unit as soon as they can. (NO TURN AROUND TIMES GIVEN FOR ANY OF THE 2 ABOVE ACTIONS OR FOLLOWING) 3. Instructed to remove the SSD from the defective unit and connect it to another machine somewhere to retrieve my info - Who ever thought of that procedure and implemented it in real life situations needs a vacation.  LONG TERM without peanut spending money.",
"Second Best - Mini i have purchased recently. Also, the Bosgame N95 has turned out well too. Upgraded the ram on N95 to 16gb, and added 2.5"" sata's on both. This i5-1135G7 is a workhorse. Fast. The pc works well in all demanding software i have used, and has become the most used of all i have in the minis. Fast in all aspects and quiet. No lock-ups or reboots. Nice Quality Product i am glad to have. A word on/to reviews/ers: If you don't know how to upgrade hardware,  use it like it was sold to you. i.e. Don't tear it up from inability, then give the company/seller a 1 star rating. Sure the sata cable connetions on most these minis are flimsy, like some excuses. If you want Tough: buy a case,powersupply, motherboard, cpu,ram, drives, All of good quality,, and build you one that doesn't flex here and there, and has real upgrade options. Don't forget the OS - which may cost you half of what you paid for the Bosgame i5-1135G7 that already has it.",
"Ive never had an ASUS laptop before so I wasnt sure how it was going to feel, it felt great. Trackpad is responsive, but a bit loud. Its been 2 Years with this laptop all through college and airports and Its held up great! The battery is not very great and you really need to bring the charger everywhere you go unless youre just moving rooms in your house for less than an 1 and a half. It can get annoying trying to watch Netflix or YouTube and it constantly needs to be plugged in. While gaming you definitely need to plug in or your games will run half as slowly as they should be, its a feature to save battery but it makes the gameplay horrible. I can say this laptop replaced my gaming desktop and Ive used it basically everyday for 2 years, and its still running smooth.

I would definitely recommend getting another stick of RAM for the laptop, theres a free slot already so you just need to get either an 8gb or 4gb stick of laptop ram depending on what you already have, just match it up and your games will be running amazingly.

It can easily play GTA V, Fortnite, Warzone, basically anything you throw at it if you play with the graphic settings. I also recommend buying a gaming mouse because using the trackpad can be impossible for certain games.

The most annoying thing about the laptop is that all the ports. 3 USBs, Ethernet, charging, is all on the left side of the computer so using wired mice and headsets can get annoying, and you have to loop it behind. Just the one complaint i have over the years.",
"I was excited to finally have a decent laptop with fantastic features and life like screen, but beneath the features this Asus FX-505DT laptop has major issues....despite long talks with Asus techs, and hours at home, this laptop fails to measure up.  All i wanted to do is use a USB device to run/install some programs and install a dual boot operating system,  despite hours to get the BIOS to respond, this laptop refuses to recognize ANY USB device, any USB device, thumb drive, external dvd player, any USB device.  Even with a purge of the BIOS, and complete reset of Windows 10, this machine refuses to recognize any USB device... A necessary feature in the bios , CSM fails to appear...unable to disable UEFI...and there's .more, which i wont bore you with.  I spoke to Asus techs who told me the USB devices should be recognized if windows 10 was installed and active.  This made no difference...enough.  To say the least, i am disappointed.  I have great respect for Asus brand products for desktop computers, but for this laptop, my first Asus laptop, two thumbs down.",
"I bought this laptop specifically so I can play First-person shooter games at 120 fps and use that 120hz screen to my advantage. Unfortunately, the Ryzen 7 3850h alongside the GTX 1650 M is not enough to play games such as Fortnite at 120 fps. I had all my settings set to low except view distance and 3D resolution, and I was barely getting 80 fps, which would drop down to 50 during heated fights. During night time in-game, I would hardly see anything because of how dim the screen was.
Overall, the device is worth the price but might not be what you are looking for. I would suggest their A15 model equipped with the RTX 2060 and the Ryzen 7 4800h for First-Person Shooter games such as Fortnite, Apex, CS GO, etc.

To conclude, the Asus fx505 is a device that is worth its price but might not be for heavy gaming because of the low specs it has and its dim screen. For 300 dollars more, you can get the A15, which is more equipped for heaving gaming.

Oh, and the fans get loud during games, but it doesn't bother me.",
"I'm solid ASUS, my last one still works had for 8 years. Actually gave it to my daughter. I have all Samsung ram, hard drives upgrades.
I haven't had more blue screens of death. I have about $1,600 wrapped up in this damn thing. Problem is a Zeus don't kick out any driver upgrade software. And neither does Microsoft. For all this money I shouldn't have to pay out the nose for more software.
The problem is is AMD has software, Asus has software, Samsung, and every other little driver. Well they all put their little storage banks on the hard drives then adds up real fast.
I just need the driver's I don't need all this bloatware.
They are conflict in each other.
I've had probably 15 blue screen of death and it's never the same thing.
I've had to reload Windows 10 pro probably five times in the last month or so.
I don't know a Zeus has a software program that is a program but you must have the Microsoft app to go with it which I think Microsoft apps suck and is part of the combat compatibility issue. But as soon as I load them drivers my crap freezes.
I'm just really disappointed. I pretty much have a $1,600 brick. You must really know what you're doing to tolerate this poo. Make sure you have a thumb drive bootable. might as well put all your software on on another thumb drive too.
I bought this for a good motherboard and foundation upgradable for reason.
I last a Zeus notebook upgrades no problem.
I have wanted to throw this off the third story building, and smash it to pieces I'm not upset then I realize how much money I have into it.
Also noticed my wireless mouse 2.0( in 2.0 port) has issues bad wont work with 3.1 drives 3.0 ports (2.0 compatible) Mouse freaks out and wont work at all. But as im writing this I have two 2.0 thumbs in the same ports and works just fine.",
"I was very impressed by the item description and read a couple of reviews and quickly purchased the ASUS TUF (2019) Gaming Laptop, 15.6 120Hz Full HD IPS-Type, AMD Ryzen 7 3750H, GeForce GTX 1650, 8GB DDR4, 512GB PCIe SSD version.  While waiting for UPS to deliver the laptop, as it needed a signature, I started reading all the reviews. I quickly became very concerned with the reviews detailing the BSOD's and black screens. I then googled video reviews, and found that almost all reviewers by professional techs recommended this laptop as a beginner's gaming machine.

I have now used the laptop for approximately 12 hours and have these observations. First the negative. I HATE that all USB slots are on the left side of the laptop. There is nothing on the right side. I spend a lot of time gaming and laying down with the laptop on my belly and I have my left hand resting on the left side as I constantly use the Function 1-4 keys. The USB plug in adapter is rubbing a blister on my hand as there is no way to avoid it unless I don't use a mouse, which is unacceptable. The arrow keys are a little to far towards the middle, so I had to program the number pad keys for moving in game. Also, the F1 key starts too far to the right, so I have had to program my gaming keys somewhat.

With that said, the laptop runs smoothly, is very quiet and does not run hot at all. Now I only play Everquest which is not a demanding game for a PC, but there is no heat or noise from the fans. I like the keyboard other than what I described above, and have no idea why some people have complained about the keyboard and touch pad. The lighted keyboard does change colors, but it isn't a distraction for me at all, so I haven't tried to change it to stay at one color as of yet.

So I like this laptop. If I experience any issues I will update my review.",
"I had high hopes about this laptop, as I saw that it was well rated and ASUS is a dependable brand. However, within three months, the hard drive failed completely with without warning from the SMART system, and I lost everything on it. At that point, I reached out to Snow Bell for a refund for the cost of the hard drive, which they quickly got back to me about and everything was great.

Since then, I've just had a world of problems with this laptop. The system device and display drivers kept failing, making my HDMI port unusable. Several of my keys are discolored or partially burnt out. The function allowing me to change my fan speed didn't work any longer than the first day I used it. The track pad, as some other users have complained about, is slow to respond and often rebellious against what you actually want it to do. The screen flickers like a candle when the brightness is anything but 100% when it's running on battery, and the fan on the left side rattles loudly if the laptop is anything but perfectly level.

Of course, I reached out to Snow Bell again, but where their customer service got back to me in a matter of hours before, it's been days and they seem to be nowhere to be found. Even Amazon failed to connect me to their customer service call center. Maybe I just got a dud, but I'm thanking my past self for purchasing a warranty, as that seems to be my only option for this lemon now.",
"When i first got the laptop it was fast. I had issues with the operating system, apparently I received a corrupt OS. After reinstalling windows which is no problem at all fast and easy process I'm back to normal. Overall a very fast laptop.
Gaming: I can run Metro Exodus on high settings WOW no problem. Honestly, there is really not a game that you cant play on high settings and get a decent frame rate plus the screen makes the games look AWSOME. Also the fans get loud to keep the beast cool, but who cares if your buying this for gaming your going to have either headphones or a headset so that doesnt really matter to me.
BUT do yourself a favor and get another stick of RAM to unlock the potential of this computer, because the laptop is gimped by that one stick of DDR4.
General Use: I mean it has a sdd lets be honest its quick in doing anything browsing the web and those sorts of things.
OVERALL: Would i buy again? Yes i believe if you have any sorts of knowledge about computers your going to buy this and be able to fix any problems you come across. Its a powerful computer that's portable for gamer's. I'm extremely satisfied with this computer. Only thing i might upgrade now is another ssd in the computer for more storage.",
"This product works fine EXCEPT for the sizing/partitioning of the hard drive. The product description indicates a 192gb hard drive, which is does have, however, it was received with the drive already partitioned into a c: drive of 62gb and a d: drive of 128gb. It would be expected that the drive, if partitioned at the factory, would have a much smaller d: drive loaded with recovery data for consumer to use in the event of an issue sometime down the road; giving the consumer the option to partition the drive to his/her particular desires. Though that issue can be corrected by the consumer, it is disappointing that the option is not readily available to less-experienced users.
UPDATE: Purchased in June 2022. Trusted Amazon and HP - my mistake. This product is a toy compared to a real computer. I am disappointed in its performance but even more disappointed in the inability to upgrade the unit to make it more in-line with what I use a computer for - had no idea it could not be tweaked to improve the internal storage and memory. Basically piece of garbage - will rework my Toshiba laptop even though it is older technology and will not accept Windows 11 but that is a secondary issue - at least it is a better overall machine!!!!!!",
"cant get online. Says i have to first register windows, but when i try, it says it cant register my version of windows (which is listed as windows 10 and has what appears to be a valid product key), and i have to first visit ""the store"" and purchase A GENUINE VERSION OF WINDOWS. . .So i guess that means this computer came with a fake version of windows that allows you to turn it on and set it up, but wont actually allow you to use the computer and go online or anything. I cant even use Word because it too has to be registered online, which requires that i first register windows, but again, i cant. Already loaded too many personal files on it to be comfortable returning it, so i guess what i bought is a really really expensive external hard drive to store my media on, because that is the only thing it will allow me to do.

I stopped buying Dell over a decade ago because their quality went way down and their stuff just wasnt worth anything to me anymore. I decided to give it a shot again cause i just needed something small and inexpensive to use mainly for writing. I wasnts expecting anything great, but I never dreamed that their quality would be so severely lacking now that i wouldnt even be able to use Word or get online to download another word processor!  Ill never buy a Dell ever again.",
"I got 3 of these during the black friday sale on dell.com and they have all had problems!  I never write a reveiw and am only on here because I've wasted so much time with this product.  I'm sorry guys because I buy a lot of good products and I rely on customer reviews and always want to leave one but am never motivated enough till I've lots so much time and money.

One of the three was DOA and was sent back for a refund because the other two seemed to have Chinese malware installed and I manually removed but didn't want to do it for a third one (all gifts) after that.

Of the two remaining, one is rarely used because the person said its too slow!  You will click a button and then watch it click on the system a second later and then start a really slow load.  The person using it is young and so hasn't used it much or complained but I know its just junk.

The third one that has been used for school is broke after 7 months of causal use.  The F1 key popped out 1st.  The left hinge stopped working a month ago.  Now the ""reduce volume seems to be stuck but if you press it, it responds so it must be a software issue but it's volume down icon on the screen is stuck and keeps trying to go lower.  We have tried to do a factory reinstall but it's still stuck.  Dell wants $219 to fix the F1 key and hinge and can't say if the volume down software issue can be fixed.  I paid $299 for these devices on black friday and have lost hundreds more in time trying to clean them up and maintain them out of guilt for the recipients.

This is just a truly sad product and I hope it just all came from a bad batch for Dell and their customers sake.",
"Bought this for my mom. She wanted something light weight and she liked the color. This piece of garbage isn't worth a $100. I didn't expect it to be a fast computer but slow isn't the right word for it. Sometimes it just stops. When it gets like that you may as well set it on the table and leave it until it finally starts doing something several minutes later. I'm talking about basic tasks like opening a web browser or even logging on from startup. It would just get stuck. We kept it up to date and ran virus scans regularly. She only used it to check facebook, email and basic web browsing. It should have never been released, especially for $500. If it's trying to do a windows update you can't do anything else with it until the update is complete because it doesn't have the processing power to do more than one thing at a time. A $500 computer should be able to easily handle basic tasks. We will probably wipe it and give it to a thrift store. I wouldn't give it to anyone I know. I'm definitely disapointed to know Dell would sell something like this. Maybe we got a bad one but I have seen enough bad reviews to know ours isn't the only bad one.",
