input,output
"It's OK runs well so far, it's still new so time will tell as these products seem to deteriorate over time. It is somewhat fast thus far and handles all apps pretty well. One issue I am running to a lot is Apps in the google store give me the error 'may not be optimized for this device"" about 80% of the time. Seems rather odd. Supposed to be with Android 5 but was delivered with Android 6. Upon starting is immediately began an update and now it is running Android 7.1.1. Perhaps that might be the issue with the apps. it also is confused about the ""home page"" because ALL apps I install say it is ""adding short cut to the home page"" but actually it is adding it to the page just to the right of the home page, and YES, I know where my home page is. Screen is very clear and it reads books really well with ZERO pixelation. I am finding it is much easier to use it in landscape mode but I am constantly clicking back button and multiple page button over and over again. It's also very easy the click the apps on the bottom row by accident as well......I am for ever opening up the camera by accident. I hate the position of the rear camera...when in landscape and trying to take a picture my fingers always get in the way of the lense due to its poor placement. Si I have to hold it by the very edge so as not to block the lense and that makes it a bit difficult to hold it steady and secure. Pictures are OK for the price I paid but the camera does not do well in poor or low lighting. I also am finding that the touch screen is somewhat sporadic. Some times while online it takes multiple taps in order for it to register. I don't know how many camera shots I have lost due to the fact that it wasn't registering my taps on the button. My biggest downer about this thus far is the speaker placement. In portrait it is on the bottom left and in landscape it is on the bottom right, right where my hand is. Super poor placement IMO. Overall, for the price I paid for it I am somewhat happy but I just have to get used to the things I don't like about it.",
"Had this now for about a week. My previous tablet was a ipad gen 4 which has a 10"" screen.
Bare in mind this is the mid grade tablet from Samsung. And you won't be disappointed; this product suits my needs but only just.
The screen clarity leaves a little to be desired for. And the speed is bare minimum for my Internet browsing and mild game playing. I understand this could be in part due to Internet speeds but is a bit slow on noninternet based applications as well.
But going from 10"" screen to 8"" has been pretty painless for me. My old Ipad usually got left behind at home or in the car when out and about due to size and weight.

Pros:
  Weight and size make the travel and Daly use friends
  Does everything I need it to do
  Battery life is quite good
  I feel the 8"" screen size is perfect to accomplish most everything
Cons:
  A little slow
  Medium quality graphics or screen quality

I'm not a super tech guy so excuse me If I used the wrong terminology above.",
"Works great!Specially satisfied with the new android update.It's good for gaming experience but not all games work perfectly.Some lag a bit but other than that it's good for the ones on the middle range and it's a good time killer for those who need one.The battery is pretty good.It lasts at least a day with full charge of gaming with taking breaks.I calculated about 5 percent for half an hour of playing..but of course it also depends on the game itself.The battery charges for 'bout 4 to 5 hours which isn't all that great but for this price and the quality you're getting i believe it's worth the buck.
I'm very satisfied with the display.Very bright and pronoun colors.I was in a dilemma between this and the Tab E 9'6 but when i watched a comparison video i got infatuated.Put on something colorful on that lock screen and watch the magic.
Only negative i can say is that i received the wrong power brick.We don't use the same kind in most of Europe.

P.S I forgot to mention that the sound speaker is in a pretty bad place.Like when you use the accelometer in racing games i keep blocking it with my hand.Not an issue if you put on a pair headphones though.",
"After a week of usage I love this little tablet. I have been using iPads since they were initially released and have had a few. This one blows them right out of the water. The battery life is amazing. I fully charged the device when I got it and ran it through some tests. Streaming video from Netflix for 8 consecutive hours took the battery from 100% to 72% Side by side with my 4th generation iPad doing the same test the battery on the iPad drained to 15%. Yes, I'm sure the battery being new has something to do with it. but impressive nonetheless.

I setup the kids mode and allow my 4 year old son to play with it. He loves it and the kids mode allows him to play without any worry of accidental purchases, or getting into something he shouldn't.

Also the added free software they include is quite nice. The full MS Office suite comes pre-loaded which is surprisingly nice to have. I deal with a lot of Spreadsheets for work and it has allowed me to keep my laptop in my bag and handle things from the tablet.

I expanded the memory with a 128 GB micro SD. For the same amount of storage with the iPad it would cost more then buying 3 of these.

All that being said, The screen is not as sharp as I would like. But if that's not a big deal to you this thing is a winner.

I feel confident in making a recommendation for this product, and plan on buying one for my parents and siblings this Christmas.",
"Before I begin you should know we have only had this for a day so far. BUT I LOVE IT!

This was actually bought for my son (I use it also). We originally bought a kids Amazon fire and that was a huge disappointment. I didn't want to pay the amount of money they asked for an iPad so I asked multiple people and did tons of research and everything pointed to this tablet!

It took me a little while to figure out since I have never owned any Samsung products, but I'm talking 10 minutes at most. It's still set up very similarly to Apple products.

This tablet runs great, super fast, which was the main problem with the fire. This one also offers everything I was looking for.
Most parents want the ""kids time"" stuff with apps for their kids, which I believe there is an app for that on here, but I didn't. I wanted to download netflix, kids YouTube, learning apps, Disney jr, etc. That way my son could choose between what he wanted to do easily. The apps that came on here like chrome and mail and such I just moved 4 pages over and he has no idea they are there! I have my apps over there also ;)
The other great thing about this tablet is the battery life! It doesn't take long to charge and the battery actually lasts!

I'm extremely impressed with this tablet, it is definitely worth the money!
I 100% recommend this for a child or adult!",
"Being a technophobe (a lady of a certain age without a smart phone), I bought this tablet to keep up with e-mail while on a three-week trip on which I didn't want to haul my laptop.  I couldn't possibly have set up the tablet myself, and in fact, it took my very savvy computer guru several hours to set it up and to teach me how to do basic things on it.  So I suppose I would have to say that it isn't ideal for the novice or the faint of heart.  But I'm sure that once I have a chance to practice and experiment with it, I will grow to be less cautious and terrified of it.  There is much to be liked about it, but the one thing I find both frustrating and annoying is that in writing e-mails, it anticipates the words being typed and as often as not gets them wrong, but types them anyhow, necessitating constant retyping and attentive re-reading of one's messages before clicking ""send.""  I would have preferred spell-check to this anticipatory feature, which rather than speeding up the composition of a message, actually slows it down considerably.  I've not yet experimented with the tablet's many capabilities and features, including the camera, which I have been told is excellent.  I also have not added any apps.  So this review must be considered somewhat premature and a work-in-progress.",
"I just purchased this tablet, and I am in love!!! I did a lot of research on tablets, and I was looking for one that had the ability to transfer apps to the SD card. There were many that said they could, but when I did further research, they actually could not, so dont be fooled. The screen size on this tablet was 8, and I am used to using a 7 screen, but I am now a HUGE fan of the 8 screen this one has. The processer was 1.5 GB ram, and it runs so fast and smooth. I got a 16 GB and added a 16 GB SD card, and I have tons of room. We also have a nexus 7 tablet, and I was looking for something comparable to that, and this one did, and exceeded my expectations. The nexus 7 does not allow an SD card, so this is an upgrade from that tablet for sure.  Also, I am huge into the online game apps, and I have installed 13 of my game apps on it, in addition to many other apps within the first week, with no problems at all. I have so much room on it, it is amazing. I have read many reviews that say the screen quality on this particular tablet was not good, and I have found that to be false in my opinion. This tablet came with the home charger, which was something some other tablets I reviewed did not all come with. I would recommend this tablet to anyone looking for a fast, high capacity tablet that is not so expensive that you have to mortgage your house to own one.",
"Easy to navigate.  Good response time.  Received new on 12/31/2017 with 60% charge - user manual advises that charging should be done before first use.  Time to charge was about as user manual explains - 4 hours to charge if fully discharged.  So, it took about 1 hour 35 minutes.  Easy to set up - not too many screens to go through and not difficult to figure out how to provide input to go on to next screens.  User manual misled me by its description of Microsoft Word being preloaded on the tablet.  After copying a Word document from a computer to this tablet, the document could not be opened - interface sought a network connection.  I thought that I would be able to at least view a Word document without a network connection.  Samsung customer service person informed me that at least for first use, tablet software will seek updates to Word, and therefore a network connection is needed.  After initial updates, I was informed that I should be able to work with Word documents without a network connection.  Found out 1/1/2018 that Ethernet network option is not available despite the user manual describing that it is.  Samsung customer service informed me that the Galaxy Tab A is not designed to work on an Ethernet network no matter what adapter is tried.  Internet search, that included discussions among tablet users did not find any assurances of tablet use with any Ethernet adapters.,",
"About a year ago I bought a Samsung Galaxy 7 tablet for my son as a Christmas gift, but never had a lot of interest in buying one for myself, seeing I owned a Kindle Fire.  Even though he is disabled, my son loves his tablet and takes it most everywhere with him.  I have a Samsung Galaxy 5 cell phone, but it is a work phone and I am not allowed to load apps or anything to it.  Love the phone but not being able to do anything non-work related with it is frustrating.  So between my son's tablet and my phone, I have always been impressed with Samsung mobile type products.  A friend has a Samsung tablet and suggested I might find it easier to use and more beneficial than my Kindle.  I had always found the Kindle to be difficult to use except as a reader and for audible books and I have had it for several years now.  So I figured I would give a tablet a try and this Samsung seemed to fit the bill.  I am very impressed with it and now do everything I use to do with the Kindle plus a lot more.  Accessing email, using apps, shopping on Amazon, plus syncing it with my Kindle and Audible books, is a lot better than my Kindle.  So the Kindle will gather dust or I will give it to a friend.  BTW - I don't get the cheap looking comments on this tablet.  Not so in my opinion and I have a nice case for it, so not sure what folks are referring to in that regard.  Very nice tablet for this first time tablet owner.",
"This tablet arrived today so it is a little early for a full review, but I will review anyway.  I was looking for a lightweight, fast, and reliable Android table for under $300. This one definitely exceeds my expectations (and at a great price). My husband has a new ipad (not air) that I think its too bulky. Also, I don't love iOS and am not a fan of itunes.  So Apple was out for me.  I was worried Samsung would add too many layers on top of the pure Android experience, but Lollipop (it upgraded already!) seems to have minimal overt Samsung modifications (at least none that bother me).

I am not a heavy video consumer but the few videos I did watch (you tube) looked great to me.
Strongly recommend this table at this price point!

Update:
I've had it for a few days and still love a lot about it.  What I don't love: even though I don't watch a lot of video content, the resolution difference between this tablet and my phone is enormous.  I didn't think it would matter to me -- but it does.  I like reading websites on my phone better, which defeats one of the purposes of this tablet. Also, the touch screen isn't always as responsive as I'm used to.  I haven't seen anyone else mention this in the Tab A, so maybe it is just this device. I also get a lag sometimes that I never get on my Moto X (phone).  I'm leaning toward returning it right now even though I still think it is a great tablet otherwise.  Changed from 5 to 4 stars.",
Got this tablet as a Christmas gift.  Have had iPads & phones for a number of years so hard to rate an android like I do apple.  I do like the tablet and can do pretty much what our apples do.  The main thing I may be unhappy with is not being able to move some of the apps to the SD card.  I don't go app crazy so I only have a few apps but I'm disappointed that some won't move to the external SD card and it seems like the 16 GB memory is filling up fast.  Haven't checked user guide to see if there are more options to free up space once the internal storage is full but could be I can uninstall a lot of pre-loaded apps that I won't use. Galaxy has a great reputation and I do like the chance to learn about android since my wife has an android tablet.  Because it's not like iOS it takes a while to accomplish what we want but so far have muddled my way through things.  I have also heard because android is a user based OS that it is easier to hack. Also read that sometimes moving apps or some things from 1 android OS to another may not work.  The tablet seems to run slower than apples and at times it seems like it locks up.  I'm  sure if you're an android fan the tablet would rate 5 stars.  I gave it 4 because the cost of the android is more reasonable than apple.  Hope this is helpful.,
"I got this as a gift when my old Tab 3 died on me, and I'm happy that I did. The larger sized screen on this one (8 as opposed to my old one being 7) makes typing a lot easier. The screen is also very crisp and clear and I have no problem with the resolution as other reviewers complained about.

Pros:
Beautiful, clear screen

The colors on everything are nice

Apps load and run quickly and play perfectly

The speeds of things (for the most part, see my 'cons' list) are really fast

The split screen feature seems nice, but I only used it once and I don't need it really

The tablet itself is pretty lightweight and comfortable

The rear camera is REALLY nice, the auto-focus is great, and it takes very clear nice photos in the daytime. Nighttime photos varies depending on the amount of lighting

Cons:
Browser & Youtube speeds - I find that Chrome crawls and loads pages slowly, even mobile versions. Often I wait quite a long time for something to load on a page, or the youtube app will show the spinning wheel for quite some time. I didn't have this issue with the older Tab 3 with browsing, but I did with Youtube so perhaps it's an issue with Youtube's app? Either way, browser speeds were sluggish.

Fingerprints show up BIG TIME on the glass. The first time I used it and put it down I could see every detail of where my fingers had been.

The front facing camera is awful in every lighting. I found myself trying to awkwardly take pictures with the back camera instead of the front because the front one is just bad. I'm also really not feeling the facial beauty thing it does on self photos and I haven't found a way to turn it off yet. It also doesn't appear to have the auto focus the rear camera does.",
"I have been an Apple iPad purist for years. When I recently gave my mother my iPad Mini (she is having some issues with her vision and it's easier for her to use for certain apps than her phone), I thought I'd be content with just having my Pro 9.7. However, I like to read in bed, and the larger iPad really doesn't work well for that. I considered a Kindle Paperwhite, but since the Paperwhite doesn't reverse to a black field with white text I didn't want to use that and needed something for which I could use the Kindle app.

I decided to try an Android tablet, which would be significantly less expensive than a new Mini 4. Plus, I'd been wanting to get experience with Android because I have friends who have Android phones who are always asking me questions about them for which I have no answer. After doing a bit of research, I decided on the Galaxy Tab A 8-inch, which was almost exactly the same size as the Mini. Several local stores had good sales but nobody ... and I mean NOBODY ... had one in stock. They had plenty of the 7"" tablets but with the smaller size and only 8GB of memory, even with the SD expansion slot, I wasn't interested. So I ordered it here.

I am very pleased with this device. It was easy to set up and it's been responsive and intuitive to use. The size and form factor are nearly identical to my old Mini. If anything I like the Kindle app better on the Android than on the iPad -- not the least of which is because you can buy Kindle books directly from the Android app and not from the Apple one (has to do with Apple demanding 30% of all sales on the iPad, which includes Kindle books. Can't say I blame Amazon for not wanting part of that ""deal"").

I only have one minor complaint and not a large enough one to warrant a loss of a star -- you can't turn down the ambient light on the Galaxy as far as you can with the Mini. This only becomes an issue because I tend to stay up later than my husband so when I am reading he is trying to sleep, and it seems like I can't get the screen as dark as my Mini could go. Curiously, he says the ambient light it throws seems to be less overall and it doesn't bother him at all. Maybe it projects less overall but it seems brighter to me.",
"Update 4/2/2016: BUYER BEWARE: While I am still happy with this tablet, I purchased this as an Open Box item from Amazon's Warehouse. I have purchased other products from them, was really happy at the ""deals"" I got, and got them covered with an extended warranty through Square Trade. It occurred to me I hadn't covered this tablet and tried to do so. After jumping through a ton of hoops, I was informed Amazon changed its policy and no longer offers Square Trade warranties for Amazon Warehouse. The other two warranty suggestions I received got so many horrible reviews from users, I wondered why these were even available at Amazon.

To add insult to injury, I purchased a lovely case to protect this beautiful tablet, set it down on the window sill and it slipped off and cracked ... in the case! Ugh! Thank goodness I bought it with my American Express card, which protects purchases (including drops) in the first 90days. That said, please keep in mind that Amazon will NOT help you with quality warranties on Warehouse merchandise AND, not for nothing, but I'm a little unhappy that the tablet is so ""fragile"" (?) that the screen cracks so easily, and very unhappy that the cover offered such little protection. I am very careful with my things & often have them for YEARS, so I am a bit disappointed in the fragility of this product.

Original review: I am very happy with the Samsung tablet. I have watched more than  a few on demand videos now and don't understand the criticism of picture/screen quality - it's beautiful. I have the 8"" Tab A and couldn't be happier with my decision. I charged it fully when I got it on Sunday (!); today is Friday and I am only now charging it again. Mind you, the battery was at about 46%. Incredibly decent. And during that time, I watched about 3 hours of video content, checked email daily and left WiFi on. My cover puts the tablet to sleep when closed and wakes it up when opened, so it has not been shut down in six days. I have access to all the apps I could need and LOVE that it comes loaded with Microsoft Office - giving me access to Word, Excel  and Power Point.  I don't know how well the camera and video work yet but will update if something is amis. I had this on my Wish list and kept an eye for a deal. I spotted one in the Amazon Warehouse, listed in very good condition for $151.00 vs. $195.00. I would say it is BRAND new and cannot imagine email you could see a difference! Outstanding. The tablet was still in the cellophane with plugs and cords. Very pleased and would definitely recommend AND buy again.",
"First, many thanks to Amazon! Outstanding service, as always!
Samsung Galaxy Tab A 8"" Tablet. I purchased it because my 4"" Galaxy Player has a very old version of Android: 2.3.5. Therefore some of my beloved applications start disappearing because their creators upgraded them for a higher Android version. So sad. My little player was and still is the best hardware there is with all the bells and whistles that many of the new tablets can't match today.
So, my experience with Samsung's tablet:
8"" is too big for my little hands. Holding it to read a book or the news with one hand is a pain. Try both hands, and you'll find your fingers on the screen, which, normally will make the tablet to respond to some commands and switch the screens, open up other apps...and so forth. And I have the continuous sensation that the tablet wants to slip an fall all the time.
Another annoying feature is the screen brightness. Yes, I did try to set it up from Auto On/Off. In the dark, at night, it darkens. In the daylight, brightens. Very strange way of acting and totally stubborn despite the settings. Missing a + and - for manually adjusting it. (Because in the top front of screen there is a sensor that watches you and adjust the brightness of the screen based on if thinks you are looking at it or not? how maddening is that? The tablet knows better what you need? How hard is to push a + or a -  /setting ????
The most annoying issue is on how the Marshmallow, 6.0 is distorting the resolution on some applications. Didn't they learned that when upgrading to a new OS version, the video capacity of the computers(tablets) is to be considered?
All my beloved puzzle games are not plastered on an 8"" screen, they look like a tank rolled over them, if you ever booted your Windows OS in Safe Mode, you know what I see here.
The tablet came with the Lollypop, but once you unpack it, set it up and connect it online, it automatically updates, upgrades and so on.
So, in 5 minutes from connecting I had the Marshmallow, 6.01. (btw, fabulous fast connectivity and speed from my unlocked T-Mobile WiFi hotspot device).
I am sick and tired being used by Microsoft over the years of being an unpaid - but - paying tester of their OS. It seems that Google is now doing the same.
However, looking at it, the tablet is very attractive, and I won't contest most buyers here are satisfied. And congratulations to all! Overall, it is a good buy. Samsung and Amazon are both in my heart.
But based on my personal inability to handle the device (hands too small) I have to return it, and I am really sorry.
If anyone returns it, please don't forget: Delete the Google account you created in the tablet (not your gmail account!), then reset it to the factory settings before returning it. Because that's the nice thing to do.",
"The missing stars are 1) on one side for the bloatware Samsung packs on this tablet. I don't care about or can download myself if I want to: Skype, Netflix, Word, Excel, PowerPoint and some more. Why is it most manufacturers believe this will help? I would be better to let the owner decide. 2) Anothe other reason I took a star away is Lollipop 5.02... Really..? On 2016...? Lollipop (Android 5 was released on 2014). Yes, I know Samsung promised Lollipop for the Tab A... but when...? 2018..? This is now a ONE YEAR OLD tablet, that came with an ALREADY OLD ANDROID VERSION and STILL HAS NO UPDATE TO MARSHMALLOW, so I've stopped dreaming about ""N"". Next tablet will be a Nexus. No doubt about it!

Felt good to let that out of my system. Now, on the good side, the 4:3 format is just great, and the 8 inches is like the perfect size. I come from a Tab 2 7.0 oldie and I prefer tablets I can hold on one hand. For the record: I use the tablet for study during the day and some reading on the bed.

Finally, the original Samsung clamp is also great. It holds to the Tab A with a special lock the Tab has, and looks nice! It has a reasonbale price.",
